{
  "eventId": "a1000003-1111-4111-8111-000000000003",
  "schemaVersion": "1.0",
  "eventType": "DATA",
  "occurredAt": "2026-09-11T08:15:32Z",
  "entityType": "SUBSCRIBER",
  "entityId": "SUB-000001",
  "payload": {
    "sessionId": "SESSION-000001",
    "networkNodeId": "NODE-CHI-001",
    "bytesUploaded": 1000000,
    "bytesDownloaded": 20000000,
    "durationSeconds": 300
  }
}
