{
  "eventId": "a1000005-1111-4111-8111-000000000005",
  "schemaVersion": "1.0",
  "eventType": "BILLING",
  "occurredAt": "2026-09-11T08:15:33Z",
  "entityType": "SUBSCRIBER",
  "entityId": "SUB-000001",
  "scenarioRunId": "b1000001-2222-4222-8222-000000000001",
  "payload": {
    "transactionRef": "TXN-000001",
    "amountMinor": 12345,
    "currency": "MDL"
  }
}
